{
    "name": "John Smith",
    "contact": {
        "email": "john.smith@example.com",
        "phone": "987-654-3210"
    },
    "education": [
        {
            "institution": "Marine Science University",
            "degree": "Doctor of Philosophy",
            "fieldOfStudy": "Oceanography",
            "startDate": "2012-09-01",
            "endDate": "2017-06-30"
        },
        {
            "institution": "Marine Science University",
            "degree": "Master of Science",
            "fieldOfStudy": "Marine Biology",
            "startDate": "2010-09-01",
            "endDate": "2012-06-30"
        },
        {
            "institution": "Coastal University",
            "degree": "Bachelor of Science",
            "fieldOfStudy": "Environmental Science",
            "startDate": "2006-09-01",
            "endDate": "2010-06-30"
        }
    ],
    "experiences": [
        {
            "company": "Marine Science University",
            "position": "Teaching Assistant",
            "startDate": "2012-09-01",
            "endDate": "2014-06-30",
            "responsibilities": [
                "Assisted professors with course preparation and delivery",
                "Graded assignments and exams",
                "Conducted lab sessions and field trips"
            ]
        },
        {
            "company": "Marine Science University",
            "position": "Research Assistant",
            "startDate": "2014-07-01",
            "endDate": "2017-06-30",
            "responsibilities": [
                "Conducted research on marine ecosystems",
                "Collected and analyzed oceanographic data",
                "Published research findings in scientific journals"
            ]
        },
        {
            "company": "Ocean Conservation Non-Profit",
            "position": "Advisor",
            "startDate": "2017-07-01",
            "endDate": "Present",
            "responsibilities": [
                "Provided expertise on marine conservation projects",
                "Developed educational programs and materials",
                "Collaborated with stakeholders to promote ocean sustainability"
            ]
        }
    ],
    "interests": [
        "Marine Conservation",
        "Scuba Diving",
        "Environmental Education"
    ],
    "skills": [
        "Data Analysis",
        "Field Research",
        "Scientific Writing",
        "Public Speaking",
        "Project Management"
    ]
}
