{
    "name": "Jane Doe",
    "contact": {
        "email": "jane.doe@example.com",
        "phone": "123-456-7890"
    },
    "education": [
        {
            "institution": "University of Technology",
            "degree": "Master of Science",
            "fieldOfStudy": "Computer Science",
            "startDate": "2015-09-01",
            "endDate": "2017-06-30"
        },
        {
            "institution": "University of Technology",
            "degree": "Bachelor of Science",
            "fieldOfStudy": "Computer Science",
            "startDate": "2011-09-01",
            "endDate": "2015-06-30"
        }
    ],
    "experiences": [
        {
            "company": "Big Tech Inc.",
            "position": "Software Engineer",
            "startDate": "2017-07-01",
            "endDate": "2020-12-31",
            "responsibilities": [
                "Developed and maintained web applications",
                "Collaborated with cross-functional teams",
                "Implemented new features and optimized existing ones"
            ]
        },
        {
            "company": "Startup One",
            "position": "Software Engineer",
            "startDate": "2021-01-01",
            "endDate": "2022-06-30",
            "responsibilities": [
                "Led the development of a new product",
                "Worked closely with the product team to define requirements",
                "Mentored junior developers"
            ]
        },
        {
            "company": "Startup Two",
            "position": "Senior Software Engineer",
            "startDate": "2022-07-01",
            "endDate": "Present",
            "responsibilities": [
                "Architected and implemented scalable backend services",
                "Improved system performance and reliability",
                "Conducted code reviews and ensured best practices"
            ]
        }
    ],
    "interests": [
        "Machine Learning",
        "Open Source Contributions",
        "Tech Meetups"
    ],
    "skills": [
        "Python",
        "JavaScript",
        "Django",
        "React",
        "AWS"
    ]
}
